----------------------------------------------------------------------------
CrystalDiskInfo 8.17.5 (C) 2008-2022 hiyohiyo
                                Crystal Dew World: https://crystalmark.info/
----------------------------------------------------------------------------

    OS : Windows 10 Professional [10.0 Build 19045] (x64)
  Date : 2025/08/06 15:15:46

-- Controller Map ----------------------------------------------------------
 + Standard NVM Express Controller [SCSI]
   - Sabrent Rocket Q
 + Intel(R) Chipset SATA/PCIe RST Premium Controller [SCSI]
   - ASUS BW-16D1HT
   - NVMe Sabrent Rocket Q
   - NVMe Sabrent
   - Intel(R) Optane(TM) Pinning Shell Extensions
   - Intel(R) Optane(TM) Memory and Storage Management Component
 + Intel(R) NVMe Controller [SCSI]
   - NVMe INTEL SSDPF2NV307TZ
 + Intel(R) NVMe Controller [SCSI]
   - INTEL SSDPE2KX080T8
 + Intel(R) NVMe Controller [SCSI]
   - NVMe INTEL SSDPE2KX080T8
 - Microsoft Storage Spaces Controller [SCSI]
 - Xvdd SCSI Miniport [SCSI]
 + USB Attached SCSI (UAS) Mass Storage Device [SCSI]
   - SanDisk Extreme SSD SCSI Disk Device
   - Generic SCSI Enclosure Device

-- Disk List ---------------------------------------------------------------
 (01) INTEL SSDSC2KB038T8 : 3840.7 GB [X/1/4, cs]
 (02) Sabrent Rocket Q : 1000.2 GB [0/0/0, sq] - nv
 (03) Sabrent Rocket Q : 2000.3 GB [1/1/0, nt] - nv
 (04) Sabrent : 2048.4 GB [2/1/0, nt] - nv
 (05) INTEL SSDPF2NV307TZ : 30725.9 GB [3/2/0, nt] - nv
 (06) INTEL SSDPE2KX080T8 : 8001.5 GB [4/3/0, nt] - nv
 (07) INTEL SSDPE2KX080T8 : 8001.5 GB [5/4/0, nt] - nv
 (08) SanDisk SD9SN8W512G : 500.1 GB [7/6/0, sa1] - sd

----------------------------------------------------------------------------
 (01) INTEL SSDSC2KB038T8
----------------------------------------------------------------------------
           Model : INTEL SSDSC2KB038T8
        Firmware : XCAAY132
   Serial Number : BTYF812503GY3P8EGN
       Disk Size : 3840.7 GB (8.4/137.4/3840.7/----)
     Buffer Size : Unknown
     Queue Depth : 1
    # of Sectors : 7501476528
   Rotation Rate : ---- (SSD)
       Interface : Serial ATA
   Major Version : ACS-3
   Minor Version : ACS-3 Revision 5
   Transfer Mode : ---- | SATA/600
  Power On Hours : Unknown
  Power On Count : Unknown
     Temperature : Unknown
   Health Status : Unknown
        Features : S.M.A.R.T., TRIM, GPL
       APM Level : ----
       AAM Level : ----
    Drive Letter : 

-- IDENTIFY_DEVICE ---------------------------------------------------------
        0    1    2    3    4    5    6    7    8    9
000: 0040 3FFF C837 0010 0000 0000 003F 0000 0000 0000
010: 4254 5946 3831 3235 3033 4759 3350 3845 474E 2020
020: 0000 0000 0000 5843 4141 5931 3332 494E 5445 4C20
030: 5353 4453 4332 4B42 3033 3854 3820 2020 2020 2020
040: 2020 2020 2020 2020 2020 2020 2020 8001 4001 2F00
050: 4000 0000 0000 0006 3FFF 0010 003F FC10 00FB FD01
060: FFFF 0FFF 0000 0007 0003 0078 0078 0078 0078 402C
070: 0000 0000 0000 0000 0000 0000 840E 0000 0040 0040
080: 07FC 006D 7069 7401 6163 7069 B401 6143 407F 0005
090: 0005 0000 0000 0000 0000 0000 0000 0000 0000 0000
100: 72B0 BF1F 0001 0000 0000 0004 6003 0000 55CD 2E41
110: 4F4F A7ED 0000 0000 0000 0000 0000 0000 0000 415C
120: 411C 0000 0000 0000 0000 0000 0000 0000 0000 001C
130: 0000 0000 0000 0000 0000 0000 0000 0000 0000 0000
140: 2A41 5353 4552 545F 3130 3045 3430 3730 2020 5245
150: 0000 0000 0000 0000 0000 0000 0000 0000 0000 0000
160: 0000 0000 0000 0000 0000 0000 0000 0000 0003 0001
170: 0000 0000 0000 0000 0000 0000 6236 6565 3535 6263
180: 3161 3866 2B53 5953 5445 4D20 2020 3230 3139 3033
190: 3236 3136 3231 2033 2E32 5F59 6F75 6E67 7376 696C
200: 6C65 5265 6672 6573 684D 5231 003D 0000 0000 4000
210: 0000 0000 0000 0000 0000 0000 0000 0001 0000 0000
220: 0000 0000 10FF 0000 0000 0000 0000 0000 0000 0000
230: 72B0 BF1F 0001 0000 0001 FFFF 0000 0000 0000 0000
240: 0000 0000 0000 0000 0000 0000 0000 0000 0000 0000
250: 0000 0000 0000 0000 0000 C1A5

-- SMART_READ_DATA ---------------------------------------------------------
     +0 +1 +2 +3 +4 +5 +6 +7 +8 +9 +A +B +C +D +E +F
000: 00 00 00 00 00 00 00 00 00 00 00 00 00 00 00 00
010: 00 00 00 00 00 00 00 00 00 00 00 00 00 00 00 00
020: 00 00 00 00 00 00 00 00 00 00 00 00 00 00 00 00
030: 00 00 00 00 00 00 00 00 00 00 00 00 00 00 00 00
040: 00 00 00 00 00 00 00 00 00 00 00 00 00 00 00 00
050: 00 00 00 00 00 00 00 00 00 00 00 00 00 00 00 00
060: 00 00 00 00 00 00 00 00 00 00 00 00 00 00 00 00
070: 00 00 00 00 00 00 00 00 00 00 00 00 00 00 00 00
080: 00 00 00 00 00 00 00 00 00 00 00 00 00 00 00 00
090: 00 00 00 00 00 00 00 00 00 00 00 00 00 00 00 00
0A0: 00 00 00 00 00 00 00 00 00 00 00 00 00 00 00 00
0B0: 00 00 00 00 00 00 00 00 00 00 00 00 00 00 00 00
0C0: 00 00 00 00 00 00 00 00 00 00 00 00 00 00 00 00
0D0: 00 00 00 00 00 00 00 00 00 00 00 00 00 00 00 00
0E0: 00 00 00 00 00 00 00 00 00 00 00 00 00 00 00 00
0F0: 00 00 00 00 00 00 00 00 00 00 00 00 00 00 00 00
100: 00 00 00 00 00 00 00 00 00 00 00 00 00 00 00 00
110: 00 00 00 00 00 00 00 00 00 00 00 00 00 00 00 00
120: 00 00 00 00 00 00 00 00 00 00 00 00 00 00 00 00
130: 00 00 00 00 00 00 00 00 00 00 00 00 00 00 00 00
140: 00 00 00 00 00 00 00 00 00 00 00 00 00 00 00 00
150: 00 00 00 00 00 00 00 00 00 00 00 00 00 00 00 00
160: 00 00 00 00 00 00 00 00 00 00 00 00 00 00 00 00
170: 00 00 00 00 00 00 00 00 00 00 00 00 00 00 00 00
180: 00 00 00 00 00 00 00 00 00 00 00 00 00 00 00 00
190: 00 00 00 00 00 00 00 00 00 00 00 00 00 00 00 00
1A0: 00 00 00 00 00 00 00 00 00 00 00 00 00 00 00 00
1B0: 00 00 00 00 00 00 00 00 00 00 00 00 00 00 00 00
1C0: 00 00 00 00 00 00 00 00 00 00 00 00 00 00 00 00
1D0: 00 00 00 00 00 00 00 00 00 00 00 00 00 00 00 00
1E0: 00 00 00 00 00 00 00 00 00 00 00 00 00 00 00 00
1F0: 00 00 00 00 00 00 00 00 00 00 00 00 00 00 00 00

-- SMART_READ_THRESHOLD ----------------------------------------------------
     +0 +1 +2 +3 +4 +5 +6 +7 +8 +9 +A +B +C +D +E +F
000: 00 00 00 00 00 00 00 00 00 00 00 00 00 00 00 00
010: 00 00 00 00 00 00 00 00 00 00 00 00 00 00 00 00
020: 00 00 00 00 00 00 00 00 00 00 00 00 00 00 00 00
030: 00 00 00 00 00 00 00 00 00 00 00 00 00 00 00 00
040: 00 00 00 00 00 00 00 00 00 00 00 00 00 00 00 00
050: 00 00 00 00 00 00 00 00 00 00 00 00 00 00 00 00
060: 00 00 00 00 00 00 00 00 00 00 00 00 00 00 00 00
070: 00 00 00 00 00 00 00 00 00 00 00 00 00 00 00 00
080: 00 00 00 00 00 00 00 00 00 00 00 00 00 00 00 00
090: 00 00 00 00 00 00 00 00 00 00 00 00 00 00 00 00
0A0: 00 00 00 00 00 00 00 00 00 00 00 00 00 00 00 00
0B0: 00 00 00 00 00 00 00 00 00 00 00 00 00 00 00 00
0C0: 00 00 00 00 00 00 00 00 00 00 00 00 00 00 00 00
0D0: 00 00 00 00 00 00 00 00 00 00 00 00 00 00 00 00
0E0: 00 00 00 00 00 00 00 00 00 00 00 00 00 00 00 00
0F0: 00 00 00 00 00 00 00 00 00 00 00 00 00 00 00 00
100: 00 00 00 00 00 00 00 00 00 00 00 00 00 00 00 00
110: 00 00 00 00 00 00 00 00 00 00 00 00 00 00 00 00
120: 00 00 00 00 00 00 00 00 00 00 00 00 00 00 00 00
130: 00 00 00 00 00 00 00 00 00 00 00 00 00 00 00 00
140: 00 00 00 00 00 00 00 00 00 00 00 00 00 00 00 00
150: 00 00 00 00 00 00 00 00 00 00 00 00 00 00 00 00
160: 00 00 00 00 00 00 00 00 00 00 00 00 00 00 00 00
170: 00 00 00 00 00 00 00 00 00 00 00 00 00 00 00 00
180: 00 00 00 00 00 00 00 00 00 00 00 00 00 00 00 00
190: 00 00 00 00 00 00 00 00 00 00 00 00 00 00 00 00
1A0: 00 00 00 00 00 00 00 00 00 00 00 00 00 00 00 00
1B0: 00 00 00 00 00 00 00 00 00 00 00 00 00 00 00 00
1C0: 00 00 00 00 00 00 00 00 00 00 00 00 00 00 00 00
1D0: 00 00 00 00 00 00 00 00 00 00 00 00 00 00 00 00
1E0: 00 00 00 00 00 00 00 00 00 00 00 00 00 00 00 00
1F0: 00 00 00 00 00 00 00 00 00 00 00 00 00 00 00 00

----------------------------------------------------------------------------
 (02) Sabrent Rocket Q
----------------------------------------------------------------------------
           Model : Sabrent Rocket Q
        Firmware : RKT30Q.1
   Serial Number : 7EBD0704036101597063
       Disk Size : 1000.2 GB
       Interface : NVM Express
        Standard : NVM Express 1.3
   Transfer Mode : PCIe 3.0 x4 | PCIe 3.0 x4
  Power On Hours : 9376 hours
  Power On Count : 1624 count
      Host Reads : 28684 GB
     Host Writes : 17519 GB
     Temperature : 39 C (102 F)
   Health Status : Good (82 %)
        Features : S.M.A.R.T., TRIM, VolatileWriteCache
    Drive Letter : F:

-- S.M.A.R.T. --------------------------------------------------------------
ID RawValues(6) Attribute Name
01 000000000000 Critical Warning
02 000000000138 Composite Temperature
03 000000000064 Available Spare
04 000000000005 Available Spare Threshold
05 000000000012 Percentage Used
06 00000395EA55 Data Units Read
07 000002309E7C Data Units Written
08 000019969E50 Host Read Commands
09 00001C677918 Host Write Commands
0A 000000000C1F Controller Busy Time
0B 000000000658 Power Cycles
0C 0000000024A0 Power On Hours
0D 00000000013F Unsafe Shutdowns
0E 000000000000 Media and Data Integrity Errors
0F 000000000286 Number of Error Information Log Entries

-- IDENTIFY_DEVICE ---------------------------------------------------------
        0    1    2    3    4    5    6    7    8    9
000: 1987 1987 4537 4442 3730 3430 3330 3136 3130 3935
010: 3037 3336 6153 7262 6E65 2074 6F52 6B63 7465 5120
020: 2020 2020 2020 2020 2020 2020 2020 2020 2020 2020
030: 2020 2020 4B52 3354 5130 312E A701 6479 0900 0001
040: 0300 0001 9680 0098 9680 0098 0200 0000 0002 0000
050: 0000 0000 0000 0000 0000 0000 0000 0000 0000 0000
060: 0000 0000 0000 0000 0000 0000 0000 0000 0000 0000
070: 0000 0000 0000 0000 0000 0000 0000 0000 0000 0000
080: 0000 0000 0000 0000 0000 0000 0000 0000 0000 0000
090: 0000 0000 0000 0000 0000 0000 0000 0000 0000 0000
100: 0000 0000 0000 0000 0000 0000 0000 0000 0000 0000
110: 0000 0000 0000 0000 0000 0000 0000 0000 0000 0000
120: 0000 0000 0000 0000 0000 0000 0000 0000 0017 0303
130: 0812 043E 0101 015C 0161 0064 0000 0000 0000 0000
140: 6000 E0DB 00E8 0000 0000 0000 0000 0000 0000 0000
150: 0000 0000 0000 0000 0000 0000 0000 0000 000A 0100
160: 0000 0001 0139 0157 0000 0000 0000 0000 0000 0000
170: 0000 0000 0000 0000 0000 0000 0000 0000 0000 0000
180: 0000 0000 0000 0000 0000 0000 0000 0000 0000 0000
190: 0000 0000 0000 0000 0000 0000 0000 0000 0000 0000
200: 0000 0000 0000 0000 0000 0000 0000 0000 0000 0000
210: 0000 0000 0000 0000 0000 0000 0000 0000 0000 0000
220: 0000 0000 0000 0000 0000 0000 0000 0000 0000 0000
230: 0000 0000 0000 0000 0000 0000 0000 0000 0000 0000
240: 0000 0000 0000 0000 0000 0000 0000 0000 0000 0000
250: 0000 0000 0000 0000 0000 0000

-- SMART_NVME --------------------------------------------------------------
     +0 +1 +2 +3 +4 +5 +6 +7 +8 +9 +A +B +C +D +E +F
000: 00 38 01 64 05 12 00 00 00 00 00 00 00 00 00 00
010: 00 00 00 00 00 00 00 00 00 00 00 00 00 00 00 00
020: 55 EA 95 03 00 00 00 00 00 00 00 00 00 00 00 00
030: 7C 9E 30 02 00 00 00 00 00 00 00 00 00 00 00 00
040: 50 9E 96 19 00 00 00 00 00 00 00 00 00 00 00 00
050: 18 79 67 1C 00 00 00 00 00 00 00 00 00 00 00 00
060: 1F 0C 00 00 00 00 00 00 00 00 00 00 00 00 00 00
070: 58 06 00 00 00 00 00 00 00 00 00 00 00 00 00 00
080: A0 24 00 00 00 00 00 00 00 00 00 00 00 00 00 00
090: 3F 01 00 00 00 00 00 00 00 00 00 00 00 00 00 00
0A0: 00 00 00 00 00 00 00 00 00 00 00 00 00 00 00 00
0B0: 86 02 00 00 00 00 00 00 00 00 00 00 00 00 00 00
0C0: 00 00 00 00 00 00 00 00 00 00 00 00 00 00 00 00
0D0: 00 00 00 00 00 00 00 00 00 00 00 00 00 00 00 00
0E0: 00 00 00 00 00 00 00 00 00 00 00 00 00 00 00 00
0F0: 00 00 00 00 00 00 00 00 00 00 00 00 00 00 00 00
100: 00 00 00 00 00 00 00 00 00 00 00 00 00 00 00 00
110: 00 00 00 00 00 00 00 00 00 00 00 00 00 00 00 00
120: 00 00 00 00 00 00 00 00 00 00 00 00 00 00 00 00
130: 00 00 00 00 00 00 00 00 00 00 00 00 00 00 00 00
140: 00 00 00 00 00 00 00 00 00 00 00 00 00 00 00 00
150: 00 00 00 00 00 00 00 00 00 00 00 00 00 00 00 00
160: 00 00 00 00 00 00 00 00 00 00 00 00 00 00 00 00
170: 00 00 00 00 00 00 00 00 00 00 00 00 00 00 00 00
180: 00 00 00 00 00 00 00 00 00 00 00 00 00 00 00 00
190: 00 00 00 00 00 00 00 00 00 00 00 00 00 00 00 00
1A0: 00 00 00 00 00 00 00 00 00 00 00 00 00 00 00 00
1B0: 00 00 00 00 00 00 00 00 00 00 00 00 00 00 00 00
1C0: 00 00 00 00 00 00 00 00 00 00 00 00 00 00 00 00
1D0: 00 00 00 00 00 00 00 00 00 00 00 00 00 00 00 00
1E0: 00 00 00 00 00 00 00 00 00 00 00 00 00 00 00 00
1F0: 00 00 00 00 00 00 00 00 00 00 00 00 00 00 00 00

----------------------------------------------------------------------------
 (03) Sabrent Rocket Q
----------------------------------------------------------------------------
           Model : Sabrent Rocket Q
        Firmware : RKT30Q.2
   Serial Number : 7F60070B179D89208808
       Disk Size : 2000.3 GB
       Interface : NVM Express
        Standard : NVM Express 1.3
   Transfer Mode : ---- | ----
  Power On Hours : 9074 hours
  Power On Count : 1587 count
      Host Reads : 17312 GB
     Host Writes : 11054 GB
     Temperature : 35 C (95 F)
   Health Status : Good (95 %)
        Features : S.M.A.R.T., TRIM, VolatileWriteCache
    Drive Letter : D:

-- S.M.A.R.T. --------------------------------------------------------------
ID RawValues(6) Attribute Name
01 000000000000 Critical Warning
02 000000000134 Composite Temperature
03 000000000064 Available Spare
04 000000000005 Available Spare Threshold
05 000000000005 Percentage Used
06 00000229FFC1 Data Units Read
07 00000161C106 Data Units Written
08 0000094D8FF8 Host Read Commands
09 000004EF68D4 Host Write Commands
0A 000000000261 Controller Busy Time
0B 000000000633 Power Cycles
0C 000000002372 Power On Hours
0D 000000000142 Unsafe Shutdowns
0E 000000000000 Media and Data Integrity Errors
0F 000000000D5D Number of Error Information Log Entries

-- IDENTIFY_DEVICE ---------------------------------------------------------
        0    1    2    3    4    5    6    7    8    9
000: 1987 1987 4637 3036 3730 4230 3731 4439 3938 3032
010: 3838 3830 6153 7262 6E65 2074 6F52 6B63 7465 5120
020: 2020 2020 2020 2020 2020 2020 2020 2020 2020 2020
030: 2020 2020 4B52 3354 5130 322E A701 6479 0900 0001
040: 0300 0001 9680 0098 9680 0098 0200 0000 0002 0000
050: 0000 0000 0000 0000 0000 0000 0000 0000 0000 0000
060: 0000 0000 0000 0000 0000 0000 0000 0000 0000 0000
070: 0000 0000 0000 0000 0000 0000 0000 0000 0000 0000
080: 0000 0000 0000 0000 0000 0000 0000 0000 0000 0000
090: 0000 0000 0000 0000 0000 0000 0000 0000 0000 0000
100: 0000 0000 0000 0000 0000 0000 0000 0000 0000 0000
110: 0000 0000 0000 0000 0000 0000 0000 0000 0000 0000
120: 0000 0000 0000 0000 0000 0000 0000 0000 0017 0303
130: 0812 043E 0101 015C 0161 0064 0000 0000 0000 0000
140: 6000 C111 01D1 0000 0000 0000 0000 0000 0000 0000
150: 0000 0000 0000 0000 0000 0000 0000 0000 000A 0100
160: 0000 0001 0139 0157 0000 0000 0000 0000 0000 0000
170: 0000 0000 0000 0000 0000 0000 0000 0000 0000 0000
180: 0000 0000 0000 0000 0000 0000 0000 0000 0000 0000
190: 0000 0000 0000 0000 0000 0000 0000 0000 0000 0000
200: 0000 0000 0000 0000 0000 0000 0000 0000 0000 0000
210: 0000 0000 0000 0000 0000 0000 0000 0000 0000 0000
220: 0000 0000 0000 0000 0000 0000 0000 0000 0000 0000
230: 0000 0000 0000 0000 0000 0000 0000 0000 0000 0000
240: 0000 0000 0000 0000 0000 0000 0000 0000 0000 0000
250: 0000 0000 0000 0000 0000 0000

-- SMART_NVME --------------------------------------------------------------
     +0 +1 +2 +3 +4 +5 +6 +7 +8 +9 +A +B +C +D +E +F
000: 00 34 01 64 05 05 00 00 00 00 00 00 00 00 00 00
010: 00 00 00 00 00 00 00 00 00 00 00 00 00 00 00 00
020: C1 FF 29 02 00 00 00 00 00 00 00 00 00 00 00 00
030: 06 C1 61 01 00 00 00 00 00 00 00 00 00 00 00 00
040: F8 8F 4D 09 00 00 00 00 00 00 00 00 00 00 00 00
050: D4 68 EF 04 00 00 00 00 00 00 00 00 00 00 00 00
060: 61 02 00 00 00 00 00 00 00 00 00 00 00 00 00 00
070: 33 06 00 00 00 00 00 00 00 00 00 00 00 00 00 00
080: 72 23 00 00 00 00 00 00 00 00 00 00 00 00 00 00
090: 42 01 00 00 00 00 00 00 00 00 00 00 00 00 00 00
0A0: 00 00 00 00 00 00 00 00 00 00 00 00 00 00 00 00
0B0: 5D 0D 00 00 00 00 00 00 00 00 00 00 00 00 00 00
0C0: 00 00 00 00 00 00 00 00 00 00 00 00 00 00 00 00
0D0: 00 00 00 00 00 00 00 00 04 00 00 00 00 00 00 00
0E0: DE 0D 00 00 00 00 00 00 00 00 00 00 00 00 00 00
0F0: 00 00 00 00 00 00 00 00 00 00 00 00 00 00 00 00
100: 00 00 00 00 00 00 00 00 00 00 00 00 00 00 00 00
110: 00 00 00 00 00 00 00 00 00 00 00 00 00 00 00 00
120: 00 00 00 00 00 00 00 00 00 00 00 00 00 00 00 00
130: 00 00 00 00 00 00 00 00 00 00 00 00 00 00 00 00
140: 00 00 00 00 00 00 00 00 00 00 00 00 00 00 00 00
150: 00 00 00 00 00 00 00 00 00 00 00 00 00 00 00 00
160: 00 00 00 00 00 00 00 00 00 00 00 00 00 00 00 00
170: 00 00 00 00 00 00 00 00 00 00 00 00 00 00 00 00
180: 00 00 00 00 00 00 00 00 00 00 00 00 00 00 00 00
190: 00 00 00 00 00 00 00 00 00 00 00 00 00 00 00 00
1A0: 00 00 00 00 00 00 00 00 00 00 00 00 00 00 00 00
1B0: 00 00 00 00 00 00 00 00 00 00 00 00 00 00 00 00
1C0: 00 00 00 00 00 00 00 00 00 00 00 00 00 00 00 00
1D0: 00 00 00 00 00 00 00 00 00 00 00 00 00 00 00 00
1E0: 00 00 00 00 00 00 00 00 00 00 00 00 00 00 00 00
1F0: 00 00 00 00 00 00 00 00 00 00 00 00 00 00 00 00

----------------------------------------------------------------------------
 (04) Sabrent
----------------------------------------------------------------------------
           Model : Sabrent
        Firmware : RKT343.4
   Serial Number : 443B071602ED00000154
       Disk Size : 2048.4 GB
       Interface : NVM Express
        Standard : NVM Express 1.3
   Transfer Mode : ---- | ----
  Power On Hours : 8519 hours
  Power On Count : 1460 count
      Host Reads : 186272 GB
     Host Writes : 71556 GB
     Temperature : 38 C (100 F)
   Health Status : Good (96 %)
        Features : S.M.A.R.T., TRIM, VolatileWriteCache
    Drive Letter : C:

-- S.M.A.R.T. --------------------------------------------------------------
ID RawValues(6) Attribute Name
01 000000000000 Critical Warning
02 000000000137 Composite Temperature
03 000000000064 Available Spare
04 000000000005 Available Spare Threshold
05 000000000004 Percentage Used
06 00001748B678 Data Units Read
07 000008F1CB0C Data Units Written
08 0000E9388083 Host Read Commands
09 0000793BA206 Host Write Commands
0A 000000001D8F Controller Busy Time
0B 0000000005B4 Power Cycles
0C 000000002147 Power On Hours
0D 00000000012A Unsafe Shutdowns
0E 000000000000 Media and Data Integrity Errors
0F 000000000EBB Number of Error Information Log Entries

-- IDENTIFY_DEVICE ---------------------------------------------------------
        0    1    2    3    4    5    6    7    8    9
000: 1987 1987 3434 4233 3730 3631 3230 4445 3030 3030
010: 3130 3435 6153 7262 6E65 2074 2020 2020 2020 2020
020: 2020 2020 2020 2020 2020 2020 2020 2020 2020 2020
030: 2020 2020 4B52 3354 3334 342E A701 6479 0900 0001
040: 0300 0001 9680 0098 9680 0098 0200 0000 0002 0000
050: 0000 0000 0000 0000 0000 0000 0000 0000 0000 0000
060: 0000 0000 0000 0000 0000 0000 0000 0000 0000 0000
070: 0000 0000 0000 0000 0000 0000 0000 0000 0000 0000
080: 0000 0000 0000 0000 0000 0000 0000 0000 0000 0000
090: 0000 0000 0000 0000 0000 0000 0000 0000 0000 0000
100: 0000 0000 0000 0000 0000 0000 0000 0000 0000 0000
110: 0000 0000 0000 0000 0000 0000 0000 0000 0000 0000
120: 0000 0000 0000 0000 0000 0000 0000 0000 0017 0303
130: 0812 043E 0101 015C 0161 0064 0000 0000 0000 0000
140: 6000 EEA5 01DC 0000 0000 0000 0000 0000 0000 0000
150: 0000 0000 0000 0000 0000 0000 0000 0000 000A 0100
160: 0000 0001 0139 0157 0000 0000 0000 0000 0000 0000
170: 0000 0000 0000 0000 0000 0000 0000 0000 0000 0000
180: 0000 0000 0000 0000 0000 0000 0000 0000 0000 0000
190: 0000 0000 0000 0000 0000 0000 0000 0000 0000 0000
200: 0000 0000 0000 0000 0000 0000 0000 0000 0000 0000
210: 0000 0000 0000 0000 0000 0000 0000 0000 0000 0000
220: 0000 0000 0000 0000 0000 0000 0000 0000 0000 0000
230: 0000 0000 0000 0000 0000 0000 0000 0000 0000 0000
240: 0000 0000 0000 0000 0000 0000 0000 0000 0000 0000
250: 0000 0000 0000 0000 0000 0000

-- SMART_NVME --------------------------------------------------------------
     +0 +1 +2 +3 +4 +5 +6 +7 +8 +9 +A +B +C +D +E +F
000: 00 37 01 64 05 04 00 00 00 00 00 00 00 00 00 00
010: 00 00 00 00 00 00 00 00 00 00 00 00 00 00 00 00
020: 78 B6 48 17 00 00 00 00 00 00 00 00 00 00 00 00
030: 0C CB F1 08 00 00 00 00 00 00 00 00 00 00 00 00
040: 83 80 38 E9 00 00 00 00 00 00 00 00 00 00 00 00
050: 06 A2 3B 79 00 00 00 00 00 00 00 00 00 00 00 00
060: 8F 1D 00 00 00 00 00 00 00 00 00 00 00 00 00 00
070: B4 05 00 00 00 00 00 00 00 00 00 00 00 00 00 00
080: 47 21 00 00 00 00 00 00 00 00 00 00 00 00 00 00
090: 2A 01 00 00 00 00 00 00 00 00 00 00 00 00 00 00
0A0: 00 00 00 00 00 00 00 00 00 00 00 00 00 00 00 00
0B0: BB 0E 00 00 00 00 00 00 00 00 00 00 00 00 00 00
0C0: 00 00 00 00 00 00 00 00 00 00 00 00 00 00 00 00
0D0: 00 00 00 00 00 00 00 00 02 00 00 00 01 00 00 00
0E0: 78 00 00 00 AA 00 00 00 00 00 00 00 00 00 00 00
0F0: 00 00 00 00 00 00 00 00 00 00 00 00 00 00 00 00
100: 00 00 00 00 00 00 00 00 00 00 00 00 00 00 00 00
110: 00 00 00 00 00 00 00 00 00 00 00 00 00 00 00 00
120: 00 00 00 00 00 00 00 00 00 00 00 00 00 00 00 00
130: 00 00 00 00 00 00 00 00 00 00 00 00 00 00 00 00
140: 00 00 00 00 00 00 00 00 00 00 00 00 00 00 00 00
150: 00 00 00 00 00 00 00 00 00 00 00 00 00 00 00 00
160: 00 00 00 00 00 00 00 00 00 00 00 00 00 00 00 00
170: 00 00 00 00 00 00 00 00 00 00 00 00 00 00 00 00
180: 00 00 00 00 00 00 00 00 00 00 00 00 00 00 00 00
190: 00 00 00 00 00 00 00 00 00 00 00 00 00 00 00 00
1A0: 00 00 00 00 00 00 00 00 00 00 00 00 00 00 00 00
1B0: 00 00 00 00 00 00 00 00 00 00 00 00 00 00 00 00
1C0: 00 00 00 00 00 00 00 00 00 00 00 00 00 00 00 00
1D0: 00 00 00 00 00 00 00 00 00 00 00 00 00 00 00 00
1E0: 00 00 00 00 00 00 00 00 00 00 00 00 00 00 00 00
1F0: 00 00 00 00 00 00 00 00 00 00 00 00 00 00 00 00

----------------------------------------------------------------------------
 (05) INTEL SSDPF2NV307TZ
----------------------------------------------------------------------------
           Model : INTEL SSDPF2NV307TZ
        Firmware : ACV10310
   Serial Number : PHAC2453009730PGGN
       Disk Size : 30725.9 GB
       Interface : NVM Express
        Standard : NVM Express 1.4
   Transfer Mode : PCIe 3.0 x4 | PCIe 4.0 x4
  Power On Hours : 5029 hours
  Power On Count : 800 count
      Host Reads : 22542 GB
     Host Writes : 29774 GB
     Temperature : 38 C (100 F)
   Health Status : Good (100 %)
        Features : S.M.A.R.T., TRIM
    Drive Letter : X:

-- S.M.A.R.T. --------------------------------------------------------------
ID RawValues(6) Attribute Name
01 000000000000 Critical Warning
02 000000000137 Composite Temperature
03 000000000064 Available Spare
04 00000000000A Available Spare Threshold
05 000000000000 Percentage Used
06 000002D15A72 Data Units Read
07 000003B8C583 Data Units Written
08 00002C7A5F19 Host Read Commands
09 00002080C55E Host Write Commands
0A 00000000000A Controller Busy Time
0B 000000000320 Power Cycles
0C 0000000013A5 Power On Hours
0D 00000000005C Unsafe Shutdowns
0E 000000000000 Media and Data Integrity Errors
0F 000000000000 Number of Error Information Log Entries

-- IDENTIFY_DEVICE ---------------------------------------------------------
        0    1    2    3    4    5    6    7    8    9
000: 8086 8086 4850 4341 3432 3335 3030 3739 3033 4750
010: 4E47 2020 4E49 4554 204C 5353 5044 3246 564E 3033
020: 5437 205A 2020 2020 2020 2020 2020 2020 2020 2020
030: 2020 2020 4341 3156 3330 3031 E400 5CD2 0500 0000
040: 0400 0001 9680 0098 4B40 004C 0300 0000 0000 0000
050: 0000 0000 0000 0000 0000 0100 0000 0000 0000 0000
060: D25C 91E4 1E70 5156 0000 0000 0000 0000 0000 0000
070: 0000 0000 0000 0000 0000 0000 0000 0000 0000 0000
080: 0000 0000 0000 0000 0000 0000 0000 0000 0000 0000
090: 0000 0000 0000 0000 0000 0000 0000 0000 0000 0000
100: 0000 0000 0000 0000 0000 0000 0000 0000 0000 0000
110: 0000 0000 0000 0000 0000 0000 0000 0000 0000 0000
120: 0000 0000 0000 0000 0000 0000 0100 0100 001E 0303
130: 1E18 023F 0000 0157 0161 0064 0000 0000 0000 0000
140: 6000 F2A5 1BF1 0000 0000 0000 0000 0000 0000 0000
150: 0000 0000 0000 0000 0000 0000 0000 0000 001E 0101
160: 0000 0000 0000 0000 0003 6000 0000 0000 0000 0000
170: 0000 0000 0000 0000 0000 0000 0050 0000 0000 0000
180: 0000 0000 0000 0000 0000 0000 0000 0000 0000 0000
190: 0000 0000 0000 0000 0000 0000 0000 0000 0000 0000
200: 0000 0000 0000 0000 0000 0000 0000 0000 0000 0000
210: 0000 0000 0000 0000 0000 0000 0000 0000 0000 0000
220: 0000 0000 0000 0000 0000 0000 0000 0000 0000 0000
230: 0000 0000 0000 0000 0000 0000 0000 0000 0000 0000
240: 0000 0000 0000 0000 0000 0000 0000 0000 0000 0000
250: 0000 0000 0000 0000 0000 0000

-- SMART_NVME --------------------------------------------------------------
     +0 +1 +2 +3 +4 +5 +6 +7 +8 +9 +A +B +C +D +E +F
000: 00 37 01 64 0A 00 00 00 00 00 00 00 00 00 00 00
010: 00 00 00 00 00 00 00 00 00 00 00 00 00 00 00 00
020: 72 5A D1 02 00 00 00 00 00 00 00 00 00 00 00 00
030: 83 C5 B8 03 00 00 00 00 00 00 00 00 00 00 00 00
040: 19 5F 7A 2C 00 00 00 00 00 00 00 00 00 00 00 00
050: 5E C5 80 20 00 00 00 00 00 00 00 00 00 00 00 00
060: 0A 00 00 00 00 00 00 00 00 00 00 00 00 00 00 00
070: 20 03 00 00 00 00 00 00 00 00 00 00 00 00 00 00
080: A5 13 00 00 00 00 00 00 00 00 00 00 00 00 00 00
090: 5C 00 00 00 00 00 00 00 00 00 00 00 00 00 00 00
0A0: 00 00 00 00 00 00 00 00 00 00 00 00 00 00 00 00
0B0: 00 00 00 00 00 00 00 00 00 00 00 00 00 00 00 00
0C0: 09 00 00 00 00 00 00 00 00 00 00 00 00 00 00 00
0D0: 00 00 00 00 00 00 00 00 00 00 00 00 00 00 00 00
0E0: 00 00 00 00 00 00 00 00 00 00 00 00 00 00 00 00
0F0: 00 00 00 00 00 00 00 00 00 00 00 00 00 00 00 00
100: 00 00 00 00 00 00 00 00 00 00 00 00 00 00 00 00
110: 00 00 00 00 00 00 00 00 00 00 00 00 00 00 00 00
120: 00 00 00 00 00 00 00 00 00 00 00 00 00 00 00 00
130: 00 00 00 00 00 00 00 00 00 00 00 00 00 00 00 00
140: 00 00 00 00 00 00 00 00 00 00 00 00 00 00 00 00
150: 00 00 00 00 00 00 00 00 00 00 00 00 00 00 00 00
160: 00 00 00 00 00 00 00 00 00 00 00 00 00 00 00 00
170: 00 00 00 00 00 00 00 00 00 00 00 00 00 00 00 00
180: 00 00 00 00 00 00 00 00 00 00 00 00 00 00 00 00
190: 00 00 00 00 00 00 00 00 00 00 00 00 00 00 00 00
1A0: 00 00 00 00 00 00 00 00 00 00 00 00 00 00 00 00
1B0: 00 00 00 00 00 00 00 00 00 00 00 00 00 00 00 00
1C0: 00 00 00 00 00 00 00 00 00 00 00 00 00 00 00 00
1D0: 00 00 00 00 00 00 00 00 00 00 00 00 00 00 00 00
1E0: 00 00 00 00 00 00 00 00 00 00 00 00 00 00 00 00
1F0: 00 00 00 00 00 00 00 00 00 00 00 00 00 00 00 00

----------------------------------------------------------------------------
 (06) INTEL SSDPE2KX080T8
----------------------------------------------------------------------------
           Model : INTEL SSDPE2KX080T8
        Firmware : VDV10184
   Serial Number : BTLJ83020G5W8P0HGN
       Disk Size : 8001.5 GB
       Interface : NVM Express
        Standard : NVM Express 1.2
   Transfer Mode : PCIe 3.0 x4 | PCIe 3.0 x4
  Power On Hours : 7867 hours
  Power On Count : 1869 count
      Host Reads : 423786 GB
     Host Writes : 970217 GB
     Temperature : 40 C (104 F)
   Health Status : Good (97 %)
        Features : S.M.A.R.T., TRIM
    Drive Letter : Z:

-- S.M.A.R.T. --------------------------------------------------------------
ID RawValues(6) Attribute Name
01 000000000000 Critical Warning
02 000000000139 Composite Temperature
03 000000000063 Available Spare
04 00000000000A Available Spare Threshold
05 000000000003 Percentage Used
06 000034F92C44 Data Units Read
07 00007946F4EF Data Units Written
08 0009921EFCD2 Host Read Commands
09 000A6B6FEC4A Host Write Commands
0A 0000000023ED Controller Busy Time
0B 00000000074D Power Cycles
0C 000000001EBB Power On Hours
0D 0000000004DB Unsafe Shutdowns
0E 000000000000 Media and Data Integrity Errors
0F 00000000005C Number of Error Information Log Entries

-- IDENTIFY_DEVICE ---------------------------------------------------------
        0    1    2    3    4    5    6    7    8    9
000: 8086 8086 5442 4A4C 3338 3230 4730 5735 5038 4830
010: 4E47 2020 4E49 4554 204C 5353 5044 3245 584B 3830
020: 5430 2038 2020 2020 2020 2020 2020 2020 2020 2020
030: 2020 2020 4456 3156 3130 3438 E400 5CD2 0500 0000
040: 0200 0001 9680 0098 E1C0 00E4 0200 0000 0000 0000
050: 0000 0000 0000 0000 0000 0000 0000 0000 0000 0000
060: 0000 0000 0000 0000 0000 0000 0000 0000 0000 0000
070: 0000 0000 0000 0000 0000 0000 0000 0000 0000 0000
080: 0000 0000 0000 0000 0000 0000 0000 0000 0000 0000
090: 0000 0000 0000 0000 0000 0000 0000 0000 0000 0000
100: 0000 0000 0000 0000 0000 0000 0000 0000 0000 0000
110: 0000 0000 0000 0000 0000 0000 0000 0000 0000 0000
120: 0000 0000 0000 0000 0000 0000 0000 0100 000E 0303
130: 0E18 003F 0000 0157 0161 0000 0000 0000 0000 0000
140: 6000 0255 0747 0000 0000 0000 0000 0000 0000 0000
150: 0000 0000 0000 0000 0000 0000 0000 0000 0000 0000
160: 0000 0000 0000 0000 0000 0000 0000 0000 0000 0000
170: 0000 0000 0000 0000 0000 0000 0000 0000 0000 0000
180: 0000 0000 0000 0000 0000 0000 0000 0000 0000 0000
190: 0000 0000 0000 0000 0000 0000 0000 0000 0000 0000
200: 0000 0000 0000 0000 0000 0000 0000 0000 0000 0000
210: 0000 0000 0000 0000 0000 0000 0000 0000 0000 0000
220: 0000 0000 0000 0000 0000 0000 0000 0000 0000 0000
230: 0000 0000 0000 0000 0000 0000 0000 0000 0000 0000
240: 0000 0000 0000 0000 0000 0000 0000 0000 0000 0000
250: 0000 0000 0000 0000 0000 0000

-- SMART_NVME --------------------------------------------------------------
     +0 +1 +2 +3 +4 +5 +6 +7 +8 +9 +A +B +C +D +E +F
000: 00 39 01 63 0A 03 00 00 00 00 00 00 00 00 00 00
010: 00 00 00 00 00 00 00 00 00 00 00 00 00 00 00 00
020: 44 2C F9 34 00 00 00 00 00 00 00 00 00 00 00 00
030: EF F4 46 79 00 00 00 00 00 00 00 00 00 00 00 00
040: D2 FC 1E 92 09 00 00 00 00 00 00 00 00 00 00 00
050: 4A EC 6F 6B 0A 00 00 00 00 00 00 00 00 00 00 00
060: ED 23 00 00 00 00 00 00 00 00 00 00 00 00 00 00
070: 4D 07 00 00 00 00 00 00 00 00 00 00 00 00 00 00
080: BB 1E 00 00 00 00 00 00 00 00 00 00 00 00 00 00
090: DB 04 00 00 00 00 00 00 00 00 00 00 00 00 00 00
0A0: 00 00 00 00 00 00 00 00 00 00 00 00 00 00 00 00
0B0: 5C 00 00 00 00 00 00 00 00 00 00 00 00 00 00 00
0C0: 12 00 00 00 00 00 00 00 00 00 00 00 00 00 00 00
0D0: 00 00 00 00 00 00 00 00 00 00 00 00 00 00 00 00
0E0: 00 00 00 00 00 00 00 00 00 00 00 00 00 00 00 00
0F0: 00 00 00 00 00 00 00 00 00 00 00 00 00 00 00 00
100: 00 00 00 00 00 00 00 00 00 00 00 00 00 00 00 00
110: 00 00 00 00 00 00 00 00 00 00 00 00 00 00 00 00
120: 00 00 00 00 00 00 00 00 00 00 00 00 00 00 00 00
130: 00 00 00 00 00 00 00 00 00 00 00 00 00 00 00 00
140: 00 00 00 00 00 00 00 00 00 00 00 00 00 00 00 00
150: 00 00 00 00 00 00 00 00 00 00 00 00 00 00 00 00
160: 00 00 00 00 00 00 00 00 00 00 00 00 00 00 00 00
170: 00 00 00 00 00 00 00 00 00 00 00 00 00 00 00 00
180: 00 00 00 00 00 00 00 00 00 00 00 00 00 00 00 00
190: 00 00 00 00 00 00 00 00 00 00 00 00 00 00 00 00
1A0: 00 00 00 00 00 00 00 00 00 00 00 00 00 00 00 00
1B0: 00 00 00 00 00 00 00 00 00 00 00 00 00 00 00 00
1C0: 00 00 00 00 00 00 00 00 00 00 00 00 00 00 00 00
1D0: 00 00 00 00 00 00 00 00 00 00 00 00 00 00 00 00
1E0: 00 00 00 00 00 00 00 00 00 00 00 00 00 00 00 00
1F0: 00 00 00 00 00 00 00 00 00 00 00 00 00 00 00 00

----------------------------------------------------------------------------
 (07) INTEL SSDPE2KX080T8
----------------------------------------------------------------------------
           Model : INTEL SSDPE2KX080T8
        Firmware : VDV10052
   Serial Number : BTLJ743000608P0HGN
       Disk Size : 8001.5 GB
       Interface : NVM Express
        Standard : NVM Express 1.2
   Transfer Mode : PCIe 3.0 x4 | PCIe 3.0 x4
  Power On Hours : 6928 hours
  Power On Count : 1218 count
      Host Reads : 42476 GB
     Host Writes : 135567 GB
     Temperature : 41 C (105 F)
   Health Status : Good (100 %)
        Features : S.M.A.R.T., TRIM
    Drive Letter : Y:

-- S.M.A.R.T. --------------------------------------------------------------
ID RawValues(6) Attribute Name
01 000000000000 Critical Warning
02 00000000013A Composite Temperature
03 000000000063 Available Spare
04 00000000000A Available Spare Threshold
05 000000000000 Percentage Used
06 0000054F41CE Data Units Read
07 000010F2286C Data Units Written
08 00002B3CF699 Host Read Commands
09 0000833BFBE4 Host Write Commands
0A 00000000022E Controller Busy Time
0B 0000000004C2 Power Cycles
0C 000000001B10 Power On Hours
0D 000000000489 Unsafe Shutdowns
0E 0000000000B0 Media and Data Integrity Errors
0F 0000000000B5 Number of Error Information Log Entries

-- IDENTIFY_DEVICE ---------------------------------------------------------
        0    1    2    3    4    5    6    7    8    9
000: 8086 8086 5442 4A4C 3437 3033 3030 3036 5038 4830
010: 4E47 2020 4E49 4554 204C 5353 5044 3245 584B 3830
020: 5430 2038 2020 2020 2020 2020 2020 2020 2020 2020
030: 2020 2020 4456 3156 3030 3235 E400 5CD2 0500 0000
040: 0200 0001 8480 001E C6C0 002D 0000 0000 0000 0000
050: 0000 0000 0000 0000 0000 0000 0000 0000 0000 0000
060: 0000 0000 0000 0000 0000 0000 0000 0000 0000 0000
070: 0000 0000 0000 0000 0000 0000 0000 0000 0000 0000
080: 0000 0000 0000 0000 0000 0000 0000 0000 0000 0000
090: 0000 0000 0000 0000 0000 0000 0000 0000 0000 0000
100: 0000 0000 0000 0000 0000 0000 0000 0000 0000 0000
110: 0000 0000 0000 0000 0000 0000 0000 0000 0000 0000
120: 0000 0000 0000 0000 0000 0000 0000 0100 0006 0303
130: 0202 003F 0000 0157 0161 0000 0000 0000 0000 0000
140: 6000 0255 0747 0000 0000 0000 0000 0000 0000 0000
150: 0000 0000 0000 0000 0000 0000 0000 0000 0000 0000
160: 0000 0000 0000 0000 0000 0000 0000 0000 0000 0000
170: 0000 0000 0000 0000 0000 0000 0000 0000 0000 0000
180: 0000 0000 0000 0000 0000 0000 0000 0000 0000 0000
190: 0000 0000 0000 0000 0000 0000 0000 0000 0000 0000
200: 0000 0000 0000 0000 0000 0000 0000 0000 0000 0000
210: 0000 0000 0000 0000 0000 0000 0000 0000 0000 0000
220: 0000 0000 0000 0000 0000 0000 0000 0000 0000 0000
230: 0000 0000 0000 0000 0000 0000 0000 0000 0000 0000
240: 0000 0000 0000 0000 0000 0000 0000 0000 0000 0000
250: 0000 0000 0000 0000 0000 0000

-- SMART_NVME --------------------------------------------------------------
     +0 +1 +2 +3 +4 +5 +6 +7 +8 +9 +A +B +C +D +E +F
000: 00 3A 01 63 0A 00 00 00 00 00 00 00 00 00 00 00
010: 00 00 00 00 00 00 00 00 00 00 00 00 00 00 00 00
020: CE 41 4F 05 00 00 00 00 00 00 00 00 00 00 00 00
030: 6C 28 F2 10 00 00 00 00 00 00 00 00 00 00 00 00
040: 99 F6 3C 2B 00 00 00 00 00 00 00 00 00 00 00 00
050: E4 FB 3B 83 00 00 00 00 00 00 00 00 00 00 00 00
060: 2E 02 00 00 00 00 00 00 00 00 00 00 00 00 00 00
070: C2 04 00 00 00 00 00 00 00 00 00 00 00 00 00 00
080: 10 1B 00 00 00 00 00 00 00 00 00 00 00 00 00 00
090: 89 04 00 00 00 00 00 00 00 00 00 00 00 00 00 00
0A0: B0 00 00 00 00 00 00 00 00 00 00 00 00 00 00 00
0B0: B5 00 00 00 00 00 00 00 00 00 00 00 00 00 00 00
0C0: 15 00 00 00 00 00 00 00 00 00 00 00 00 00 00 00
0D0: 00 00 00 00 00 00 00 00 00 00 00 00 00 00 00 00
0E0: 00 00 00 00 00 00 00 00 00 00 00 00 00 00 00 00
0F0: 00 00 00 00 00 00 00 00 00 00 00 00 00 00 00 00
100: 00 00 00 00 00 00 00 00 00 00 00 00 00 00 00 00
110: 00 00 00 00 00 00 00 00 00 00 00 00 00 00 00 00
120: 00 00 00 00 00 00 00 00 00 00 00 00 00 00 00 00
130: 00 00 00 00 00 00 00 00 00 00 00 00 00 00 00 00
140: 00 00 00 00 00 00 00 00 00 00 00 00 00 00 00 00
150: 00 00 00 00 00 00 00 00 00 00 00 00 00 00 00 00
160: 00 00 00 00 00 00 00 00 00 00 00 00 00 00 00 00
170: 00 00 00 00 00 00 00 00 00 00 00 00 00 00 00 00
180: 00 00 00 00 00 00 00 00 00 00 00 00 00 00 00 00
190: 00 00 00 00 00 00 00 00 00 00 00 00 00 00 00 00
1A0: 00 00 00 00 00 00 00 00 00 00 00 00 00 00 00 00
1B0: 00 00 00 00 00 00 00 00 00 00 00 00 00 00 00 00
1C0: 00 00 00 00 00 00 00 00 00 00 00 00 00 00 00 00
1D0: 00 00 00 00 00 00 00 00 00 00 00 00 00 00 00 00
1E0: 00 00 00 00 00 00 00 00 00 00 00 00 00 00 00 00
1F0: 00 00 00 00 00 00 00 00 00 00 00 00 00 00 00 00

----------------------------------------------------------------------------
 (08) SanDisk SD9SN8W512G
----------------------------------------------------------------------------
           Model : SanDisk SD9SN8W512G
        Firmware : X61110RL
   Serial Number : 183347422478
       Disk Size : 500.1 GB (8.4/137.4/500.1/500.1)
     Buffer Size : Unknown
     Queue Depth : 32
    # of Sectors : 976773168
   Rotation Rate : ---- (SSD)
       Interface : UASP (Serial ATA)
   Major Version : ACS-4
   Minor Version : ACS-4 Revision 5
   Transfer Mode : SATA/600 | SATA/600
  Power On Hours : 1558 hours
  Power On Count : 67 count
      Host Reads : 2066 GB
     Host Writes : 1631 GB
     NAND Writes : 2416 GB
     Temperature : 42 C (107 F)
   Health Status : Good (100 %)
        Features : S.M.A.R.T., APM, NCQ, TRIM, DevSleep, GPL
       APM Level : 0080h [ON]
       AAM Level : ----
    Drive Letter : I:

-- S.M.A.R.T. --------------------------------------------------------------
ID Cur Wor Thr RawValues(6) Attribute Name
05 100 100 __0 000000000000 Reassigned Block Count
09 100 100 __0 000000000616 Power On Hours
0C 100 100 __0 000000000043 Power Cycle Count
A5 100 100 __0 0000012800CB Block Erase Count (SLC)
A6 100 100 __0 000000000002 Minimum P/E Cycles
A7 100 100 __0 00000000003C Maximum Bad Blocks per die
A8 100 100 __0 00000000000B Maximum P/E Cycles
A9 100 100 __0 0000000001F2 Total Bad Block
AA 100 100 __0 000000000000 Grown Bad Blocks
AB 100 100 __0 000000000000 Program Fail Count
AC 100 100 __0 000000000000 Erase Fail Count
AD 100 100 __0 000000000004 Average P/E Cycles
AE 100 100 __0 00000000002F Unexpected Power Loss Count
B8 100 100 __0 000000000000 End-to-End Error Detection/Correction Count
BB 100 100 __0 000000000000 Reported Uncorrectable Errors
BC 100 100 __0 0000000000F1 Command Timeout Count
C2 _58 _66 __0 00420028002A Temperature
C7 100 100 __0 000000000001 CRC Error Count
E6 100 100 __0 002800280028 Media Wearout Indicator
E8 100 100 __4 000000000064 Available Reserve Space
E9 100 100 __0 000000000970 NAND GB Written
EA 100 100 __0 0000000009A4 NAND GB Written (SLC)
F1 253 253 __0 00000000065F Total GB Written
F2 253 253 __0 000000000812 Total GB Read
F4 __0 100 __0 000000000000 Temperature Throttle Status

-- IDENTIFY_DEVICE ---------------------------------------------------------
        0    1    2    3    4    5    6    7    8    9
000: 0040 3FFF C837 0010 0000 0000 003F 0000 0000 0000
010: 3138 3333 3437 3432 3234 3738 2020 2020 2020 2020
020: 0000 0000 0000 5836 3131 3130 524C 5361 6E44 6973
030: 6B20 5344 3953 4E38 5735 3132 4720 2020 2020 2020
040: 2020 2020 2020 2020 2020 2020 2020 8001 4000 2F00
050: 4000 0200 0000 0006 3FFF 0010 003F FC10 00FB 9101
060: FFFF 0FFF 0000 0007 0003 0078 0078 0078 0078 4D20
070: 0000 0000 0000 0000 0000 001F 850E 0006 016C 0100
080: 0FF0 005E 306B 7409 4123 3069 B409 4123 207F 0001
090: 0001 0080 FFFE 0000 0000 0000 0000 0000 0000 0000
100: 6030 3A38 0000 0000 0000 0008 4000 0000 5001 B444
110: A9DA BBF6 0000 0000 0000 0000 0000 0000 0000 411C
120: 401C 0000 0000 0000 0000 0000 0000 0000 0021 4130
130: 3039 3158 5750 0000 0000 0000 0000 0000 0000 0000
140: 0000 0000 0000 0000 0000 0000 0000 0000 0000 0000
150: 0000 0000 0000 0000 0000 0000 0000 0000 0000 0000
160: 0000 0000 0000 0000 0000 0000 0000 0000 0007 0001
170: 0000 0000 0000 0000 0000 0000 2020 2020 2020 2020
180: 2020 2020 2020 2020 2020 2020 2020 2020 2020 2020
190: 2020 2020 2020 2020 2020 2020 2020 2020 2020 2020
200: 2020 2020 2020 2020 2020 2020 0000 0000 0000 4000
210: 0000 0000 0000 0000 0000 0000 0000 0001 0000 0000
220: 0000 0000 11FF 0000 0000 0000 0000 0000 0000 0000
230: 0000 0000 0000 0000 0001 0080 0000 0000 0000 0000
240: 0000 0000 0000 0000 0000 0000 0000 0000 0000 0000
250: 0000 0000 0000 0000 0000 42A5

-- SMART_READ_DATA ---------------------------------------------------------
     +0 +1 +2 +3 +4 +5 +6 +7 +8 +9 +A +B +C +D +E +F
000: 04 00 05 32 00 64 64 00 00 00 00 00 00 00 09 32
010: 00 64 64 16 06 00 00 00 00 00 0C 32 00 64 64 43
020: 00 00 00 00 00 00 A5 32 00 64 64 CB 00 28 01 00
030: 00 00 A6 32 00 64 64 02 00 00 00 00 00 00 A7 32
040: 00 64 64 3C 00 00 00 00 00 00 A8 32 00 64 64 0B
050: 00 00 00 00 00 00 A9 32 00 64 64 F2 01 00 00 00
060: 00 00 AA 32 00 64 64 00 00 00 00 00 00 00 AB 32
070: 00 64 64 00 00 00 00 00 00 00 AC 32 00 64 64 00
080: 00 00 00 00 00 00 AD 32 00 64 64 04 00 00 00 00
090: 00 00 AE 32 00 64 64 2F 00 00 00 00 00 00 B8 32
0A0: 00 64 64 00 00 00 00 00 00 00 BB 32 00 64 64 00
0B0: 00 00 00 00 00 00 BC 32 00 64 64 F1 00 00 00 00
0C0: 00 00 C2 22 00 3A 42 2A 00 28 00 42 00 00 C7 32
0D0: 00 64 64 01 00 00 00 00 00 00 E6 32 00 64 64 28
0E0: 00 28 00 28 00 00 E8 33 00 64 64 64 00 00 00 00
0F0: 00 00 E9 32 00 64 64 70 09 00 00 00 00 00 EA 32
100: 00 64 64 A4 09 00 00 00 00 00 F1 30 00 FD FD 5F
110: 06 00 00 00 00 00 F2 30 00 FD FD 12 08 00 00 00
120: 00 00 F4 32 00 00 64 00 00 00 00 00 00 00 00 00
130: 00 00 00 00 00 00 00 00 00 00 00 00 00 00 00 00
140: 00 00 00 00 00 00 00 00 00 00 00 00 00 00 00 00
150: 00 00 00 00 00 00 00 00 00 00 00 00 00 00 00 00
160: 00 00 00 00 00 00 00 00 00 00 00 00 00 00 00 11
170: 03 00 01 00 02 0A 00 00 00 00 00 00 00 00 00 00
180: 00 00 00 00 00 00 00 00 00 00 00 00 00 00 00 00
190: 00 00 00 00 00 00 00 00 00 00 00 00 00 00 00 00
1A0: 00 00 00 00 00 00 00 00 00 00 00 00 00 00 00 00
1B0: 00 00 00 00 00 00 00 00 00 00 00 00 00 00 00 00
1C0: 00 00 00 00 00 00 00 00 00 00 00 00 00 00 00 00
1D0: 00 00 00 00 00 00 00 00 00 00 00 00 00 00 00 00
1E0: 00 00 00 00 00 00 00 00 00 00 00 00 00 00 00 00
1F0: 00 00 00 00 00 00 00 00 00 00 00 00 00 00 00 1E

-- SMART_READ_THRESHOLD ----------------------------------------------------
     +0 +1 +2 +3 +4 +5 +6 +7 +8 +9 +A +B +C +D +E +F
000: 04 00 00 00 00 00 00 00 00 00 00 00 00 00 00 00
010: 00 00 00 00 00 00 00 00 00 00 00 00 00 00 00 00
020: 00 00 00 00 00 00 00 00 00 00 00 00 00 00 00 00
030: 00 00 00 00 00 00 00 00 00 00 00 00 00 00 00 00
040: 00 00 00 00 00 00 00 00 00 00 00 00 00 00 00 00
050: 00 00 00 00 00 00 00 00 00 00 00 00 00 00 00 00
060: 00 00 00 00 00 00 00 00 00 00 00 00 00 00 00 00
070: 00 00 00 00 00 00 00 00 00 00 00 00 00 00 00 00
080: 00 00 00 00 00 00 00 00 00 00 00 00 00 00 00 00
090: 00 00 00 00 00 00 00 00 00 00 00 00 00 00 00 00
0A0: 00 00 00 00 00 00 00 00 00 00 00 00 00 00 00 00
0B0: 00 00 00 00 00 00 00 00 00 00 00 00 00 00 00 00
0C0: 00 00 00 00 00 00 00 00 00 00 00 00 00 00 00 00
0D0: 00 00 00 00 00 00 00 00 00 00 00 00 00 00 00 00
0E0: 00 00 00 00 00 00 E8 04 00 00 00 00 00 00 00 00
0F0: 00 00 00 00 00 00 00 00 00 00 00 00 00 00 00 00
100: 00 00 00 00 00 00 00 00 00 00 00 00 00 00 00 00
110: 00 00 00 00 00 00 00 00 00 00 00 00 00 00 00 00
120: 00 00 00 00 00 00 00 00 00 00 00 00 00 00 00 00
130: 00 00 00 00 00 00 00 00 00 00 00 00 00 00 00 00
140: 00 00 00 00 00 00 00 00 00 00 00 00 00 00 00 00
150: 00 00 00 00 00 00 00 00 00 00 00 00 00 00 00 00
160: 00 00 00 00 00 00 00 00 00 00 00 00 00 00 00 00
170: 00 00 00 00 00 00 00 00 00 00 00 00 00 00 00 00
180: 00 00 00 00 00 00 00 00 00 00 00 00 00 00 00 00
190: 00 00 00 00 00 00 00 00 00 00 00 00 00 00 00 00
1A0: 00 00 00 00 00 00 00 00 00 00 00 00 00 00 00 00
1B0: 00 00 00 00 00 00 00 00 00 00 00 00 00 00 00 00
1C0: 00 00 00 00 00 00 00 00 00 00 00 00 00 00 00 00
1D0: 00 00 00 00 00 00 00 00 00 00 00 00 00 00 00 00
1E0: 00 00 00 00 00 00 00 00 00 00 00 00 00 00 00 00
1F0: 00 00 00 00 00 00 00 00 00 00 00 00 00 00 00 10

