----------------------------------------------------------------------------
CrystalDiskInfo 8.17.5 (C) 2008-2022 hiyohiyo
                                Crystal Dew World: https://crystalmark.info/
----------------------------------------------------------------------------

    OS : Windows 10 Enterprise [10.0 Build 17134] (x64)
  Date : 2025/08/01 23:03:09

-- Controller Map ----------------------------------------------------------
 + Standard SATA AHCI Controller [ATA]
   - INTEL SSDSC2BA400G
 - Microsoft Storage Spaces Controller [SCSI]
 - Avago Adapter, SAS3 3008 Fury -StorPort [SCSI]
 + Standard NVM Express Controller [SCSI]
   - INTEL SSDPF21Q032TB
 - Standard NVM Express Controller [SCSI]

-- Disk List ---------------------------------------------------------------
 (01) INTEL SSDSC2BA400G3 : 400.0 GB [0/1/0, pd1] - il
 (02) INTEL SSDPF21Q032TB : 3200.6 GB [1/2/0, sq] - nv

----------------------------------------------------------------------------
 (01) INTEL SSDSC2BA400G3
----------------------------------------------------------------------------
           Model : INTEL SSDSC2BA400G3
        Firmware : 5DV10270
   Serial Number : BTTV2295047P400HGN
       Disk Size : 400.0 GB (8.4/137.4/400.0/400.0)
     Buffer Size : Unknown
     Queue Depth : 32
    # of Sectors : 781422768
   Rotation Rate : ---- (SSD)
       Interface : Serial ATA
   Major Version : ACS-2
   Minor Version : ACS-2 Revision 3
   Transfer Mode : SATA/600 | SATA/600
  Power On Hours : 212 hours
  Power On Count : 210 count
      Host Reads : 8204 GB
     Host Writes : 29824 GB
     Temperature : 32 C (89 F)
   Health Status : Good (100 %)
        Features : S.M.A.R.T., NCQ, TRIM, GPL
       APM Level : ----
       AAM Level : ----
    Drive Letter : C:

-- S.M.A.R.T. --------------------------------------------------------------
ID Cur Wor Thr RawValues(6) Attribute Name
05 100 100 __0 000000000000 Re-Allocated Sector Count
09 100 100 __0 0000000000D4 Power-On Hours Count
0C 100 100 __0 0000000000D2 Power Cycle Count
AA 100 100 _10 000000000000 Available Reserved Space
AB 100 100 __0 000000000000 Program Fail Count
AC 100 100 __0 000000000000 Erase Fail Count
AE 100 100 __0 000000000082 Unexpected Power Loss
AF 100 100 _10 0000000C02DD Power Loss Protection Failure
B7 100 100 __0 000000000004 SATA Downshift Count
B8 100 100 _90 000000000000 End to End Error Detection Count
BB 100 100 __0 000000000000 Uncorrectable Error Count
BE _79 _79 __0 000015120015 Temperature
C0 100 100 __0 000000000082 Unsafe Shutdown Count
C2 100 100 __0 000000000020 Temperature
C5 100 100 __0 000000000000 Pending Sector Count
C7 100 100 __0 000000000042 CRC Error Count
E1 100 100 __0 0000000E9009 Host Writes
E2 100 100 __0 00000000FFFF Timed Workload Media Wear
E3 100 100 __0 00000000FFFF Timed Workload Host Read/Write Ratio
E4 100 100 __0 00000000FFFF Timed Workload Timer
E8 100 100 _10 000000000000 Available Reserved Space
E9 100 100 __0 000000000000 Media Wearout Indicator
EA 100 100 __0 000000000000 Thermal Throttle Status
F1 100 100 __0 0000000E9009 Total LBAs Written
F2 100 100 __0 000000040195 Total LBAs Read

-- IDENTIFY_DEVICE ---------------------------------------------------------
        0    1    2    3    4    5    6    7    8    9
000: 0040 3FFF C837 0010 0000 0000 003F 0000 0000 0000
010: 4254 5456 3232 3935 3034 3750 3430 3048 474E 2020
020: 0000 0000 0000 3544 5631 3032 3730 494E 5445 4C20
030: 5353 4453 4332 4241 3430 3047 3300 0000 0000 0000
040: 0000 0000 0000 0000 0000 0000 0000 8001 4000 2F00
050: 4000 0000 0000 0007 3FFF 0010 003F FC10 00FB B101
060: FFFF 0FFF 0000 0007 0003 0078 0078 0078 0078 4030
070: 0000 0000 0000 0000 0000 001F 850E 0006 0040 0040
080: 03FC 0110 746B 7501 6163 7469 B401 6163 207F 0002
090: 0002 0000 FFFE 0000 0000 0000 0000 0000 0000 0000
100: 90B0 2E93 0000 0000 0000 0006 6003 0000 5001 5179
110: 72E9 1B8C 0000 0000 0000 0000 0000 0000 0000 405C
120: 401C 0000 0000 0000 0000 0000 0000 0000 0029 001C
130: 0000 0000 0000 0000 0000 0000 0000 0000 0000 0000
140: 0000 0000 0000 0000 0000 0000 0000 0000 0000 0000
150: 0000 0000 0000 0000 0000 0000 0000 0000 0000 0000
160: 0000 0000 0000 0000 0000 0000 0000 0000 0003 0001
170: 0000 0000 0000 0000 0000 0000 2020 2020 2020 2020
180: 2020 2020 2020 2020 2020 2020 2020 2020 2020 2020
190: 2020 2020 2020 2020 2020 2020 2020 2020 2020 2020
200: 2020 2020 2020 2020 2020 2020 003D 0000 0000 4000
210: 0000 0000 0000 0000 0000 0000 0000 0001 0000 0000
220: 0000 0000 101F 0000 0000 0000 0000 0000 0000 0000
230: 0000 0000 0000 0000 0001 FFFF 0000 0000 0000 0000
240: 0000 0000 0000 0000 0000 0000 0000 0000 0000 0000
250: 0000 0000 0000 0000 0000 0BA5

-- SMART_READ_DATA ---------------------------------------------------------
     +0 +1 +2 +3 +4 +5 +6 +7 +8 +9 +A +B +C +D +E +F
000: 01 00 05 32 00 64 64 00 00 00 00 00 00 00 09 32
010: 00 64 64 D4 00 00 00 00 00 00 0C 32 00 64 64 D2
020: 00 00 00 00 00 00 AA 33 00 64 64 00 00 00 00 00
030: 00 00 AB 32 00 64 64 00 00 00 00 00 00 00 AC 32
040: 00 64 64 00 00 00 00 00 00 00 AE 32 00 64 64 82
050: 00 00 00 00 00 00 AF 33 00 64 64 DD 02 0C 00 00
060: 00 00 B7 32 00 64 64 04 00 00 00 00 00 00 B8 33
070: 00 64 64 00 00 00 00 00 00 00 BB 32 00 64 64 00
080: 00 00 00 00 00 00 BE 22 00 4F 4F 15 00 12 15 00
090: 00 00 C0 32 00 64 64 82 00 00 00 00 00 00 C2 22
0A0: 00 64 64 20 00 00 00 00 00 00 C5 32 00 64 64 00
0B0: 00 00 00 00 00 00 C7 3E 00 64 64 42 00 00 00 00
0C0: 00 00 E1 32 00 64 64 09 90 0E 00 00 00 00 E2 32
0D0: 00 64 64 FF FF 00 00 00 00 00 E3 32 00 64 64 FF
0E0: FF 00 00 00 00 00 E4 32 00 64 64 FF FF 00 00 00
0F0: 00 00 E8 33 00 64 64 00 00 00 00 00 00 00 E9 32
100: 00 64 64 00 00 00 00 00 00 00 EA 32 00 64 64 00
110: 00 00 00 00 00 00 F1 32 00 64 64 09 90 0E 00 00
120: 00 00 F2 32 00 64 64 95 01 04 00 00 00 00 00 00
130: 00 00 00 00 00 00 00 00 00 00 00 00 00 00 00 00
140: 00 00 00 00 00 00 00 00 00 00 00 00 00 00 00 00
150: 00 00 00 00 00 00 00 00 00 00 00 00 00 00 00 00
160: 00 00 00 00 00 00 00 00 00 00 00 00 00 00 00 79
170: 03 00 01 00 01 02 02 00 00 00 00 00 00 00 00 00
180: 00 00 00 00 00 00 00 00 00 00 00 00 00 00 00 00
190: 00 00 00 00 00 00 00 00 00 00 00 00 00 00 00 00
1A0: 00 00 00 00 00 00 00 00 00 00 00 00 00 00 00 00
1B0: 00 00 00 00 00 00 00 00 00 00 00 00 00 00 00 00
1C0: 00 00 00 00 00 00 00 00 00 00 00 00 00 00 00 00
1D0: 00 00 00 00 00 00 00 00 00 00 00 00 00 00 00 00
1E0: 00 00 00 00 00 00 00 00 00 00 00 00 00 00 00 00
1F0: 00 00 00 00 00 00 00 00 00 00 00 00 00 00 00 9E

-- SMART_READ_THRESHOLD ----------------------------------------------------
     +0 +1 +2 +3 +4 +5 +6 +7 +8 +9 +A +B +C +D +E +F
000: 01 00 05 00 00 00 00 00 00 00 00 00 00 00 09 00
010: 00 00 00 00 00 00 00 00 00 00 0C 00 00 00 00 00
020: 00 00 00 00 00 00 AA 0A 00 00 00 00 00 00 00 00
030: 00 00 AB 00 00 00 00 00 00 00 00 00 00 00 AC 00
040: 00 00 00 00 00 00 00 00 00 00 AE 00 00 00 00 00
050: 00 00 00 00 00 00 AF 0A 00 00 00 00 00 00 00 00
060: 00 00 B7 00 00 00 00 00 00 00 00 00 00 00 B8 5A
070: 00 00 00 00 00 00 00 00 00 00 BB 00 00 00 00 00
080: 00 00 00 00 00 00 BE 00 00 00 00 00 00 00 00 00
090: 00 00 C0 00 00 00 00 00 00 00 00 00 00 00 C2 00
0A0: 00 00 00 00 00 00 00 00 00 00 C5 00 00 00 00 00
0B0: 00 00 00 00 00 00 C7 00 00 00 00 00 00 00 00 00
0C0: 00 00 E1 00 00 00 00 00 00 00 00 00 00 00 E2 00
0D0: 00 00 00 00 00 00 00 00 00 00 E3 00 00 00 00 00
0E0: 00 00 00 00 00 00 E4 00 00 00 00 00 00 00 00 00
0F0: 00 00 E8 0A 00 00 00 00 00 00 00 00 00 00 E9 00
100: 00 00 00 00 00 00 00 00 00 00 EA 00 00 00 00 00
110: 00 00 00 00 00 00 F1 00 00 00 00 00 00 00 00 00
120: 00 00 F2 00 00 00 00 00 00 00 00 00 00 00 00 00
130: 00 00 00 00 00 00 00 00 00 00 00 00 00 00 00 00
140: 00 00 00 00 00 00 00 00 00 00 00 00 00 00 00 00
150: 00 00 00 00 00 00 00 00 00 00 00 00 00 00 00 00
160: 00 00 00 00 00 00 00 00 00 00 00 00 00 00 00 00
170: 00 00 00 00 00 00 00 00 00 00 00 00 00 00 00 00
180: 00 00 00 00 00 00 00 00 00 00 00 00 00 00 00 00
190: 00 00 00 00 00 00 00 00 00 00 00 00 00 00 00 00
1A0: 00 00 00 00 00 00 00 00 00 00 00 00 00 00 00 00
1B0: 00 00 00 00 00 00 00 00 00 00 00 00 00 00 00 00
1C0: 00 00 00 00 00 00 00 00 00 00 00 00 00 00 00 00
1D0: 00 00 00 00 00 00 00 00 00 00 00 00 00 00 00 00
1E0: 00 00 00 00 00 00 00 00 00 00 00 00 00 00 00 00
1F0: 00 00 00 00 00 00 00 00 00 00 00 00 00 00 00 F1

----------------------------------------------------------------------------
 (02) INTEL SSDPF21Q032TB
----------------------------------------------------------------------------
           Model : INTEL SSDPF21Q032TB
        Firmware : L0310559
   Serial Number : PHAL115400053P2GGN
       Disk Size : 3200.6 GB
       Interface : NVM Express
        Standard : NVM Express 1.4
   Transfer Mode : PCIe 3.0 x4 | PCIe 4.0 x4
  Power On Hours : 842 hours
  Power On Count : 12 count
      Host Reads : 128 GB
     Host Writes : 129 GB
     Temperature : 40 C (104 F)
   Health Status : Good (100 %)
        Features : S.M.A.R.T., TRIM
    Drive Letter : D:

-- S.M.A.R.T. --------------------------------------------------------------
ID RawValues(6) Attribute Name
01 000000000000 Critical Warning
02 000000000139 Composite Temperature
03 000000000064 Available Spare
04 000000000000 Available Spare Threshold
05 000000000000 Percentage Used
06 000000041E84 Data Units Read
07 000000042297 Data Units Written
08 00000044C4CC Host Read Commands
09 0000003F6C79 Host Write Commands
0A 000000000001 Controller Busy Time
0B 00000000000C Power Cycles
0C 00000000034A Power On Hours
0D 000000000005 Unsafe Shutdowns
0E 000000000000 Media and Data Integrity Errors
0F 000000000000 Number of Error Information Log Entries

-- IDENTIFY_DEVICE ---------------------------------------------------------
        0    1    2    3    4    5    6    7    8    9
000: 8086 8086 4850 4C41 3131 3435 3030 3530 5033 4732
010: 4E47 2020 4E49 4554 204C 5353 5044 3246 5131 3330
020: 5432 2042 2020 2020 2020 2020 2020 2020 2020 2020
030: 2020 2020 304C 3133 3530 3935 E400 5CD2 0500 0000
040: 0400 0001 8480 001E 93E0 0004 0300 0000 0000 0000
050: 0000 0000 0000 0000 0000 0100 0000 0000 0000 0000
060: D25C F2E4 4672 5153 0000 0000 0000 0000 0000 0000
070: 0000 0000 0000 0000 0000 0000 0000 0000 0000 0000
080: 0000 0000 0000 0000 0000 0000 0000 0000 0000 0000
090: 0000 0000 0000 0000 0000 0000 0000 0000 0000 0000
100: 0000 0000 0000 0000 0000 0000 0000 0000 0000 0000
110: 0000 0000 0000 0000 0000 0000 0000 0000 0000 0000
120: 0000 0000 0000 0000 0000 0000 0100 0100 001E 0303
130: 1E18 02FF 0000 0157 0161 0032 0000 0000 0000 0000
140: 6000 3485 02E9 0000 0000 0000 0000 0000 0000 0000
150: 0000 0000 0000 0000 0000 0000 0000 0000 001E 0101
160: 0000 0000 0000 0000 0003 6000 0000 0000 0000 0000
170: 0000 0000 0000 0000 0000 0000 0050 0000 0000 0000
180: 0000 0000 0000 0000 0000 0000 0000 0000 0000 0000
190: 0000 0000 0000 0000 0000 0000 0000 0000 0000 0000
200: 0000 0000 0000 0000 0000 0000 0000 0000 0000 0000
210: 0000 0000 0000 0000 0000 0000 0000 0000 0000 0000
220: 0000 0000 0000 0000 0000 0000 0000 0000 0000 0000
230: 0000 0000 0000 0000 0000 0000 0000 0000 0000 0000
240: 0000 0000 0000 0000 0000 0000 0000 0000 0000 0000
250: 0000 0000 0000 0000 0000 0000

-- SMART_NVME --------------------------------------------------------------
     +0 +1 +2 +3 +4 +5 +6 +7 +8 +9 +A +B +C +D +E +F
000: 00 39 01 64 00 00 00 00 00 00 00 00 00 00 00 00
010: 00 00 00 00 00 00 00 00 00 00 00 00 00 00 00 00
020: 84 1E 04 00 00 00 00 00 00 00 00 00 00 00 00 00
030: 97 22 04 00 00 00 00 00 00 00 00 00 00 00 00 00
040: CC C4 44 00 00 00 00 00 00 00 00 00 00 00 00 00
050: 79 6C 3F 00 00 00 00 00 00 00 00 00 00 00 00 00
060: 01 00 00 00 00 00 00 00 00 00 00 00 00 00 00 00
070: 0C 00 00 00 00 00 00 00 00 00 00 00 00 00 00 00
080: 4A 03 00 00 00 00 00 00 00 00 00 00 00 00 00 00
090: 05 00 00 00 00 00 00 00 00 00 00 00 00 00 00 00
0A0: 00 00 00 00 00 00 00 00 00 00 00 00 00 00 00 00
0B0: 00 00 00 00 00 00 00 00 00 00 00 00 00 00 00 00
0C0: 00 00 00 00 00 00 00 00 00 00 00 00 00 00 00 00
0D0: 00 00 00 00 00 00 00 00 00 00 00 00 00 00 00 00
0E0: 00 00 00 00 00 00 00 00 00 00 00 00 00 00 00 00
0F0: 00 00 00 00 00 00 00 00 00 00 00 00 00 00 00 00
100: 00 00 00 00 00 00 00 00 00 00 00 00 00 00 00 00
110: 00 00 00 00 00 00 00 00 00 00 00 00 00 00 00 00
120: 00 00 00 00 00 00 00 00 00 00 00 00 00 00 00 00
130: 00 00 00 00 00 00 00 00 00 00 00 00 00 00 00 00
140: 00 00 00 00 00 00 00 00 00 00 00 00 00 00 00 00
150: 00 00 00 00 00 00 00 00 00 00 00 00 00 00 00 00
160: 00 00 00 00 00 00 00 00 00 00 00 00 00 00 00 00
170: 00 00 00 00 00 00 00 00 00 00 00 00 00 00 00 00
180: 00 00 00 00 00 00 00 00 00 00 00 00 00 00 00 00
190: 00 00 00 00 00 00 00 00 00 00 00 00 00 00 00 00
1A0: 00 00 00 00 00 00 00 00 00 00 00 00 00 00 00 00
1B0: 00 00 00 00 00 00 00 00 00 00 00 00 00 00 00 00
1C0: 00 00 00 00 00 00 00 00 00 00 00 00 00 00 00 00
1D0: 00 00 00 00 00 00 00 00 00 00 00 00 00 00 00 00
1E0: 00 00 00 00 00 00 00 00 00 00 00 00 00 00 00 00
1F0: 00 00 00 00 00 00 00 00 00 00 00 00 00 00 00 00

